answer,true_answer,mark
"Архитектура — работа сеньоров. Джуны пишут код по их указаниям. Если джун сам решает архитектурные вопросы — это хаос. Архитектор должен контролировать все решения.","Архитектура приложения — это способ организации приложения, его структура, набор модулей и связей между ними",0
"Диаграммы UML — это архитектура. Deployment Diagram для инфраструктуры, Sequence Diagram для взаимодействия. Без UML невозможно обсудить проект с командой.","Архитектура приложения — это способ организации приложения, его структура, набор модулей и связей между ними",0
"Рефакторинг — часть архитектуры. Постоянное улучшение кода: удаление дубликатов, упрощение условий. Если код не рефакторить — архитектура деградирует.","Архитектура приложения — это способ организации приложения, его структура, набор модулей и связей между ними",0
"Code style — основа архитектуры: ESLint для JS, flake8 для Python. Автоматические проверки в CI. Без линтеров код превращается в помойку.","Архитектура приложения — это способ организации приложения, его структура, набор модулей и связей между ними",0
"Разделение кода на .h/.cpp в C++ — архитектурное правило. Заголовочные файлы для интерфейсов, .cpp для реализации. Нарушение этого ведет к ошибкам компоновки.","Архитектура приложения — это способ организации приложения, его структура, набор модулей и связей между ними",0
"MVC в Qt — это архитектура. Классы-модели (QAbstractItemModel), представления (QListView), контроллеры. Без MVC приложение неструктурированно.","Архитектура приложения — это способ организации приложения, его структура, набор модулей и связей между ними",0
"Сигналы и слоты — архитектура Qt. Связь виджетов без жестких зависимостей. Например, кнопка испускает сигнал, который принимает слот обработки. Это основа реактивного UI.","Архитектура приложения — это способ организации приложения, его структура, набор модулей и связей между ними",0
"Виджеты — строительные блоки архитектуры в Qt: QPushButton, QTableWidget. Компоновка их в QHBoxLayout / QVBoxLayout. Без виджетов нет интерфейса — значит, это архитектура.","Архитектура приложения — это способ организации приложения, его структура, набор модулей и связей между ними",0
"QAbstractItemModel — ядро архитектуры для данных. Наследование от него для кастомных моделей. Если данные не в модели — они не могут отображаться в View.","Архитектура приложения — это способ организации приложения, его структура, набор модулей и связей между ними",0
"Делегаты в Qt (QItemDelegate) — часть архитектуры. Кастомизация отрисовки элементов в QListView. Без делегатов все элементы выглядят одинаково — это ограничение.","Архитектура приложения — это способ организации приложения, его структура, набор модулей и связей между ними",0
"QMainWindow — основа архитектуры десктопных приложений. Центральный виджет, меню, тулбары, статусбар. Без него приложение не имеет структуры.","Архитектура приложения — это способ организации приложения, его структура, набор модулей и связей между ними",0
"Event loop — архитектурный механизм Qt. Очередь событий (клики, таймеры), обработка в цикле. Если блокируете цикл — приложение зависает. Понимание event loop критично.","Архитектура приложения — это способ организации приложения, его структура, набор модулей и связей между ними",0
"Ресурсы в .qrc файлах — часть архитектуры: иконки, изображения, переводы. Компиляция в бинарный файл. Без ресурсов приложение не переносимо.","Архитектура приложения — это способ организации приложения, его структура, набор модулей и связей между ними",0
"QSS (Qt Style Sheets) — архитектура стилей. CSS-подобный синтаксис для оформления виджетов. Без QSS интерфейс выглядит устаревшим.","Архитектура приложения — это способ организации приложения, его структура, набор модулей и связей между ними",0
"QML вместо C++ — современная архитектура UI. Декларативное описание интерфейсов, анимации. Для сложных приложений QML обязателен.","Архитектура приложения — это способ организации приложения, его структура, набор модулей и связей между ними",0
"Бизнес-логика — прослойка между UI и БД. Например, расчет цены с НДС в отдельном сервисе. Если логика в контроллере — архитектура нарушена.","Архитектура приложения — это способ организации приложения, его структура, набор модулей и связей между ними",0
"ORM (например, SQLAlchemy) — архитектурный слой. Маппинг объектов на таблицы БД. Ручные SQL-запросы — признак плохой архитектуры.","Архитектура приложения — это способ организации приложения, его структура, набор модулей и связей между ними",0
"Кэш запросов — архитектурное решение. Сохранение результатов БД в памяти на 5 минут. Без кэша нагрузка на базу растет, производительность падает.","Архитектура приложения — это способ организации приложения, его структура, набор модулей и связей между ними",0
"OAuth / JWT — архитектура безопасности. Токены вместо паролей, проверка подписи. Если нет OAuth — приложение не соответствует современным стандартам.","Архитектура приложения — это способ организации приложения, его структура, набор модулей и связей между ними",0
"Уведомления — элемент архитектуры: toast в углу экрана, системные нотификации. Без них пользователь не узнает о событиях. Реализация через Observer pattern.","Архитектура приложения — это способ организации приложения, его структура, набор модулей и связей между ними",0
"Audit log — часть архитектуры. Запись действий пользователя (кто, когда, что изменил). Для соответствия GDPR это обязательно. Без аудита не доказать безопасность.","Архитектура приложения — это способ организации приложения, его структура, набор модулей и связей между ними",0
"Бэкапы по расписанию — архитектурная необходимость. Ежедневные снепшоты БД, хранение на отдельном сервере. При потере данных бизнес остановится.","Архитектура приложения — это способ организации приложения, его структура, набор модулей и связей между ними",0
"Генерация отчетов — архитектурный модуль. Экспорт в PDF/Excel через библиотеки вроде Apache POI. Если отчеты нельзя выгрузить — функционал неполный.","Архитектура приложения — это способ организации приложения, его структура, набор модулей и связей между nimi",0
"Интеграция с почтой/SMS — часть архитектуры. Отправка через SMTP или API провайдеров. Например, уведомление о заказе. Без этого приложение не автономно.","Архитектура приложения — это способ организации приложения, его структура, набор модулей и связей между ними",0
"Юнит-тесты — архитектурный слой. Покрытие критических методов, mock-объекты для зависимостей. Без тестов рефакторинг опасен.","Архитектура приложения — это способ организации приложения, его структура, набор модулей и связей между ними",0
"CI/CD — архитектура доставки: Jenkins пайплайны, автоматические деплои. Без этого обновления выходят медленно. Зеленая сборка — индикатор здоровья.","Архитектура приложения — это способ организации приложения, его структура, набор модулей и связей между ними",0
"Мониторинг — часть архитектуры: Grafana дашборды, метрики из Prometheus. Если сервер упал, а вы не видите — архитектура неполноценна.","Архитектура приложения — это способ организации приложения, его структура, набор модулей и связей между ними",0
"Системы алертов — архитектурный элемент: Sentry для ошибок, PagerDuty для SMS. Без алертов проблемы обнаруживают пользователи — это провал.","Архитектура приложения — это способ организации приложения, его структура, набор модулей и связей между ними",0
"Swagger — архитектура документации. Автогенерация из кода, интерактивные примеры. Без Swagger разработчики API не поймут, как его использовать.","Архитектура приложения — это способ организации приложения, его структура, набор модулей и связей между ними",0
"Руководство пользователя — часть архитектуры. PDF-мануалы, tooltip-подсказки в UI. Если пользователь не понимает, как работать — приложение бесполезно.","Архитектура приложения — это способ организации приложения, его структура, набор модулей и связей между ними",0
"ER-диаграмма БД — архитектура данных. Связи таблиц, типы полей. Без нее невозможно разрабатывать сложные запросы. ERwin или dbdiagram.io — обязательные инструменты.","Архитектура приложения — это способ организации приложения, его структура, набор модулей и связей между ними",0
"Миграции БД — архитектурный процесс. Скрипты обновления схемы (ALTER TABLE), откаты. Без миграций нельзя безопасно обновлять продакшен.","Архитектура приложения — это способ организации приложения, его структура, набор модулей и связей между ними",0
"Валидация ввода — элемент архитектуры. Проверка email регулярками, обязательные поля. Если данные не валидируются — в БД попадет мусор.","Архитектура приложения — это способ организации приложения, его структура, набор модулей и связей между ними",0
"Абстрактные классы — основа архитектуры. Интерфейсы для сервисов, гарантия контрактов. Например, интерфейс PaymentGateway с методом processPayment().","Архитектура приложения — это способ организации приложения, его структура, набор модулей и связей между ними",0
"Dependency Injection — архитектурный паттерн. Внедрение сервисов через конструктор, а не создание внутри. Для тестируемости это обязательно.","Архитектура приложения — это способ организации приложения, его структура, набор модулей и связей между ними",0
"Принцип 'разделяй и властвуй' — философия архитектуры. Разбиение большой задачи на мелкие модули. Без этого код становится монолитной кашей.","Архитектура приложения — это способ организации приложения, его структура, набор модулей и связей между ними",0
"Импорт/экспорт данных — архитектурный слой. Конвертация в CSV/JSON через библиотеки. Без этого невозможна интеграция с другими системами.","Архитектура приложения — это способ организации приложения, его структура, набор модулей и связей между ними",0
"Планировщик задач (cron) — часть архитектуры. Автоматизация отчетов, чистка кэша по ночам. Без cron ручные операции неэффективны.","Архитектура приложения — это способ организации приложения, его структура, набор модулей и связей между ними",0
"HTTP-кеширование — архитектура веба. Заголовки Cache-Control, ETag. Снижает нагрузку на сервер, ускоряет загрузку. Без кэширования сайты тормозят.","Архитектура приложения — это способ организации приложения, его структура, набор модулей и связей между ними",0
"Микрооптимизации кода — элемент архитектуры. Замена циклов на векторизацию, кэширование вычислений. Иногда ускоряет код в 100 раз — это важно.","Архитектура приложения — это способ организации приложения, его структура, набор модулей и связей между ними",0
"Выбор БД — архитектурное решение: SQL для транзакций, NoSQL для масштабирования. Например, MongoDB для JSON-документов. Переход с SQL на NoSQL сложен — нужно выбирать сразу.","Архитектура приложения — это способ организации приложения, его структура, набор модулей и связей между ними",0
"Облачные хранилища — часть архитектуры: AWS S3 для файлов, Azure Blob Storage. Резервные копии, CDN. Без облака управление файлами сложно.","Архитектура приложения — это способ организации приложения, его структура, набор модулей и связей между ними",0
"Очереди задач — архитектура асинхронности: RabbitMQ для сообщений, Kafka для потоков. Обеспечивают надежность и масштабируемость. Без очередей система хрупкая.","Архитектура приложения — это способ организации приложения, его структура, набор модулей и связей между ними",0
"Балансировщик нагрузки (Nginx) — элемент архитектуры. Распределение запросов между серверами. Без него приложение не отмасштабируется.","Архитектура приложения — это способ организации приложения, его структура, набор модулей и связей между ними",0
"Репликация БД — архитектура отказоустойчивости. Master-Slave копии, автоматическое переключение. При падении сервера данные не потеряются.","Архитектура приложения — это способ организации приложения, его структура, набор модулей и связей между ними",0
"CDN — архитектура доставки контента: Cloudflare для статики. Кэширование изображений на краю сети. Без CDN пользователи из других стран страдают.","Архитектура приложения — это способ организации приложения, его структура, набор модулей и связей между ними",0
"Elasticsearch — архитектура поиска. Полнотекстовый поиск по данным, фасетная навигация. Если поиск медленный — пользователи уйдут.","Архитектура приложения — это способ организации приложения, его структура, набор модулей и связей между ними",0
"Геораспределение серверов — архитектура для глобальных приложений. Региональные ЦОДы, низкий пинг. Без этого пользователи в Азии ждут ответа из США.","Архитектура приложения — это способ организации приложения, его структура, набор модулей и связей между ними",0
"Serverless (AWS Lambda) — современная архитектура. Функции без серверов, оплата за вызовы. Для событийных задач это идеально.","Архитектура приложения — это способ организации приложения, его структура, набор модулей и связей между ними",0
"Infrastructure as Code (IaC) — архитектура развертывания: Terraform скрипты, CloudFormation. Воспроизводимость сред. Без IaC девопсы страдают.","Архитектура приложения — это способ организации приложения, его структура, набор модулей и связей между ними",0
"Ansible — архитектура конфигурации. Автоматизация настройки серверов, playbook'и. Ручная настройка недопустима в продакшене.","Архитектура приложения — это способ организации приложения, его структура, набор модулей и связей между ними",0
"VPN — элемент архитектуры безопасности. Шифрование трафика между серверами. Без VPN данные могут перехватить.","Архитектура приложения — это способ организации приложения, его структура, набор модулей и связей между ними",0
"Шифрование данных — архитектурный must-have: TLS для трафика, AES для хранения. Если данные в открытом виде — это нарушение GDPR.","Архитектура приложения — это способ организации приложения, его структура, набор модулей и связей между ними",0
"2FA — часть архитектуры безопасности. Подтверждение входа через SMS/приложение. Без двухфакторной аутентификации аккаунты уязвимы.","Архитектура приложения — это способ организации приложения, его структура, набор модулей и связей между ними",0
"Пентесты — архитектурная проверка. Регулярные атаки на свое приложение, отчеты уязвимостей. Без пентестов безопасность фиктивная.","Архитектура приложения — это способ организации приложения, его структура, набор модулей и связей между ними",0
"RBAC — архитектура управления доступом. Роли admin/user/guest, разрешения. Без RBAC нельзя контролировать права.","Архитектура приложения — это способ организации приложения, его структура, набор модулей и связей между ними",0
