answer,true_answer,mark
"Архитектура — это как устроена программа ""под капотом"".
Это структура и организация кода, которые определяют: как части программы взаимодействуют друг с другом, как данные передаются между компонентами, как легко можно что-то изменить или добавить новую функциональность.","Архитектура приложения — это способ организации приложения, его структура, набор модулей и связей между ними",1
"Архитектура программного приложения - представление структуры системы, включающее в себя основные компоненты и их связи друг с другом. Задаёт принцип построения(написания) и организации приложения, облегчает подход к разработке приложения","Архитектура приложения — это способ организации приложения, его структура, набор модулей и связей между ними",1
"это структурная организация кода, которая определяет : взаимодействие, компиляцию, шаблоны. архитектура делает код гибким и понятным, лёгким для тестов.","Архитектура приложения — это способ организации приложения, его структура, набор модулей и связей между ними",1
"это структура и логика приложения, а также логика по которой взаимодействуют элементы приложения между собой, логика по которой происходит работа с внешним миром, например с пользователем","Архитектура приложения — это способ организации приложения, его структура, набор модулей и связей между ними",1
"это структура и организация кода, которая определяет, как различные компоненты приложения взаимодействуют друг с другом для достижения поставленных целей.","Архитектура приложения — это способ организации приложения, его структура, набор модулей и связей между ними",1
"Это структура приложения, определяющая компоненты системы и способы их взаимодействия.

Определяет какие функции должен выполнять, какие данные будет принимать и возвращать каждый её компонент с учетом ограничений и правил взаимодействия","Архитектура приложения — это способ организации приложения, его структура, набор модулей и связей между ними",1
"Архитектура программного приложения  это как чертеж  автомобиля или же план здания для программы.
Она определяет из каких частей состоит программа, как эти части взаимодействуют, масштабируемость например при росте нагрузки, и где и как хранятся данные.
В общем это что то вроде каркаса программы, основной принцип по которому программа должна писаться.","Архитектура приложения — это способ организации приложения, его структура, набор модулей и связей между ними",1
"По сути архитектура - это идея того, как должна быть организована программа, её система, как должны взаимодействовать её элементы.
Из примеров можно выделить архитектуру модель-вид, мы её изучаем на курсе. В ней есть два элемента: модель и вид и их взаимодействие так организовано, что вид выводит пользователю какой-либо вывод, принимает от него ввод и в отталкиваясь от этого взаимодействует с моделью, которая по вводу используя внутренние данные и бизнес-логику, обновляет вид.","Архитектура приложения — это способ организации приложения, его структура, набор модулей и связей между ними",1
"это то как код структурирован, тем самым определяет как конкретные блоки между собой будут взаимодействовать, как их данные будут обрабатываться или взаимодействовать, например у Qt - это Модель-Вид-Делегат в частности","Архитектура приложения — это способ организации приложения, его структура, набор модулей и связей между ними",1
"Архитектура программного приложения это структура и организация компонентов программы, их взаимодействие, а также принципы, которые определяют, как эти элементы(модули, слои, блоки) объединяются для решения определенных задач","Архитектура приложения — это способ организации приложения, его структура, набор модулей и связей между ними",1
архитектура программного приложения - это способ организации частей программы и их взаимодействия между собой,"Архитектура приложения — это способ организации приложения, его структура, набор модулей и связей между ними",1
"структурное описание системы , оно определяет как компоненты приложения взаимодействуют между собой ,как они организованы и интегрированы.","Архитектура приложения — это способ организации приложения, его структура, набор модулей и связей между ними",1
"Архитектура программного приложения — это структурное описание системы, которое определяет, как компоненты приложения взаимодействуют друг с другом и с внешними системами.","Архитектура приложения — это способ организации приложения, его структура, набор модулей и связей между ними",1
"это структура кода, определяющая, как компоненты взаимодействуют друг с другом. например архитектура Model-View-Controller или Model-View-ViewModel.","Архитектура приложения — это способ организации приложения, его структура, набор модулей и связей между ними",1
"Архитектура программного приложения - это основное устройство приложения, например приложение может иметь архитектуру модель-вид, то есть имеется модель для хранения данных (она может быть активной- сообщать об изменении данных, или пассивной - не сообщать) и имеется вид для отображения данных в графическом окне. Еще существует архитектура модель-вид- контроллер, где контроллер позволяет обрабатывать запросы пользователя.","Архитектура приложения — это способ организации приложения, его структура, набор модулей и связей между ними",1
"Это высокоуровневая структура системы, которая определяет:
Основные компоненты (модули, сервисы)
Способы их взаимодействия(события, потоки данных)
Если простыми словами, то это ""скелет"" приложения, который показывает, как оно устроено и как будет развиваться.","Архитектура приложения — это способ организации приложения, его структура, набор модулей и связей между ними",1
"это используемые модули, их взаимодействие друг с другом, подходы использующиеся для написания кода и дальнейшего его развития.","Архитектура приложения — это способ организации приложения, его структура, набор модулей и связей между ними",1
"Архитектура программного приложения - это базовая структура программы, которая определяет, как организованы её компоненты (модули, классы, функции) и как они взаимодействуют между собой","Архитектура приложения — это способ организации приложения, его структура, набор модулей и связей между ними",1
"Это описание структуры и организации программы, которое определяет взаимодействие различных компонентов программы, в каком виде данные передаются в системе и как приложение будет развиваться в будущем.","Архитектура приложения — это способ организации приложения, его структура, набор модулей и связей между ними",1
"Архитектура программного приложения- организация системы, определяющая её структурные компоненты, их взаимодействие, как программа развивается, где и как хранятся/ обрабатываются данные","Архитектура приложения — это способ организации приложения, его структура, набор модулей и связей между ними",1
"Архитектура программного приложения представляет собой общую структуру системы, которая определяет её компоненты, их взаимодействие и принципы разработки. Она также позволяет определить, какие функции должны выполняться программой, какие входные данные должны быть обработаны и каким способом, а также какой результат должен получаться на выходе у каждой части программы.","Архитектура приложения — это способ организации приложения, его структура, набор модулей и связей между ними",1
"архитектура программного приложения - это структурное описание его компонентов и их взаимодействия. Она определяет, как различные части приложения (модули, классы, функции) организованы и как они взаимодействуют друг с другом, включая выбор технологий, паттернов проектирования и уровней абстракции. Хорошо спроектированная архитектура помогает обеспечить масштабируемость, поддержку и тестируемость приложения.","Архитектура приложения — это способ организации приложения, его структура, набор модулей и связей между ними",1
"Архитектура программного приложения — это структура и организация кода, определяющая взаимодействие компонентов, выбор технологий и распределение задач, что влияет на масштабируемость и удобство сопровождения.","Архитектура приложения — это способ организации приложения, его структура, набор модулей и связей между ними",1
"структура системы, представление описывает основные компоненты, функции.
принципы постороения, организации приложения","Архитектура приложения — это способ организации приложения, его структура, набор модулей и связей между ними",1
"Архитектура программного приложения – это способ организации кода, который определяет структуру компонентов, взаимодействие между частями.
Основные элементы:главное окно, меню, диалоговые окна,обработчики событий, модель взаимодействия.","Архитектура приложения — это способ организации приложения, его структура, набор модулей и связей между ними",1
"Архитектура приложения — структура построения кода, определяющая, какие элементы можно выделить в программе и как эти элементы должны взаимодействовать между собой для правильного выполнения поставленной задачи","Архитектура приложения — это способ организации приложения, его структура, набор модулей и связей между ними",1
"это организация всей системы, которая состоит из модулей, классов и их взаимодействий, зависимостей. она разбивает код на логические части и позволяет легко читать, улучшать, ""чинить"", тестировать его.","Архитектура приложения — это способ организации приложения, его структура, набор модулей и связей между ними",1
"Архитектура программного приложения — это способ организации и взаимодействия компонентов кода, выбор технологий и распределение обязанностей, что сказывается на возможностях масштабирования и легкости поддержки.","Архитектура приложения — это способ организации приложения, его структура, набор модулей и связей между ними",1
"- это структурное представление системы, которое описывает ее компоненты, их взаимодействие и поведение. как бы план, который определяет, как различные части приложения организованы и как они взаимодействуют друг с другом.","Архитектура приложения — это способ организации приложения, его структура, набор модулей и связей между ними",1
"Архитектура програмного приложения- это базовая структура и организация компонентов системы, их взаимодействие и принципы, определяющие работу, масштабируемость и поддержку кода","Архитектура приложения — это способ организации приложения, его структура, набор модулей и связей между ними",1
"это высокоуровневое представление структуры приложения, построенного с использованием Qt. Она определяет, как организованы компоненты Qt (виджеты, слоты, сигналы, модели) и то как они взаимодействуют между собой, как обрабатываются данные и как строится пользовательский интерфейс.","Архитектура приложения — это способ организации приложения, его структура, набор модулей и связей между ними",1
"Архитектура программного приложения - это структура по которой пишется код, описывающая основные компоненты, правила функционирования и правила взаимодействия этих компонентов между собой","Архитектура приложения — это способ организации приложения, его структура, набор модулей и связей между ними",1
"Это план организации элементов приложения и их взаимодействия между собой (если быть проще, то как устроена должна быть устроена программа).","Архитектура приложения — это способ организации приложения, его структура, набор модулей и связей между ними",1
"архитектура программного приложения - это некая структура системы, которая определяет принцип разработки, а также компоненты самой системы и их взаимодействие. как они организованы и какие технологии используются.
архитектура позволяет определить какие должны быть входные данные, как они должны быть обработаны, а также какой результат должен получаться на выходе у всех частей программы","Архитектура приложения — это способ организации приложения, его структура, набор модулей и связей между ними",1
"основные принципы работы организации системы, как разные её части взаимодействуют между собой","Архитектура приложения — это способ организации приложения, его структура, набор модулей и связей между ними",1
"Подход к проектированию и организации кода, который определяет, как различные компоненты взаимодействуют друг с другом и как приложение в целом будет работать. Она включает в себя структурирование кода, управление зависимостями, определение интерфейсов между компонентами, разделение ответственности между компонентами.","Архитектура приложения — это способ организации приложения, его структура, набор модулей и связей между ними",1
"это каркас, план, по которому приложение устроено. архитектура должна включать в себя организацию взаимодействия между собой элементов этого приложения.","Архитектура приложения — это способ организации приложения, его структура, набор модулей и связей между ними",1
"Архитектура программного приложения - это фундаментальная структура системы, определяющая её компоненты, их взаимодействие и принципы разработки.
Архитектура помогает создавать масштабируемые и легко поддерживаемые приложения.
Архитектура определяет какие функции выполняет программа, какие входные данные обрабатывает и каким способом.","Архитектура приложения — это способ организации приложения, его структура, набор модулей и связей между ними",1
"Архитектура программного приложения это структура и организация программы и ее компонентов, их взаимодействие. Кроме того, это принципы, которые определяют, как группируются эти элементы для решения задач. Более простым языком, это структурный подход к организации кода и проектированию, который играет важную роль при разработке крупных проектов","Архитектура приложения — это способ организации приложения, его структура, набор модулей и связей между ними",1
"это структура, определяющая, как компоненты приложения взаимодействуют друг с другом и с внешней средой.","Архитектура приложения — это способ организации приложения, его структура, набор модулей и связей между ними",1
"Архитектура программного приложения — это план или структура, которая показывает, как приложение устроено и как его части взаимодействуют друг с другом.","Архитектура приложения — это способ организации приложения, его структура, набор модулей и связей между ними",1
