answer,true_answer,mark
это строение структуры элементов для оптимальной работы приложения,"Архитектура приложения — это способ организации приложения, его структура, набор модулей и связей между ними",1
"Это некие решения, свод правил для организации компонентов приложения, а также логики их взаимодействия.","Архитектура приложения — это способ организации приложения, его структура, набор модулей и связей между ними",1
"Это описание структуры программного приложения, набор инструментов, на основе которых оно реализовано","Архитектура приложения — это способ организации приложения, его структура, набор модулей и связей между ними",1
"Это структура и организация  компонентов приложения, а также их взаимодействие друг с другом","Архитектура приложения — это способ организации приложения, его структура, набор модулей и связей между ними",1
Архитектура программного приложения - это взаимодействие всех элементов приложения с учётом версий и других тонких моментов,"Архитектура приложения — это способ организации приложения, его структура, набор модулей и связей между ними",1
"Архитектура программного приложения -- это структура взаимодействующих объектов в приложении, выстроенных в иерархию.","Архитектура приложения — это способ организации приложения, его структура, набор модулей и связей между ними",1
Архитектурой программного приложения можно считать совокупность модулей приложения и связи между ними(наличие некоторой логики связи),"Архитектура приложения — это способ организации приложения, его структура, набор модулей и связей между ними",1
Архитектура программного приложения это структура и организация компонентов системы и их взаимодействия.,"Архитектура приложения — это способ организации приложения, его структура, набор модулей и связей между ними",1
"Архитектура программного приложения - это структура и организация компонентов приложения, их взаимодействие между собой. Архитектура определяет, как компоненты приложения будут взаимодействовать друг с другом, какой функционал легко можно интегрировать в приложение, а какой нет.","Архитектура приложения — это способ организации приложения, его структура, набор модулей и связей между ними",1
"Это описание компонентов, входящих в структуру программного  приложения, описание взаимосвязей между этими компонентами. Грамотно составленная архитектура программного приложения позволяет ускорить процесс разработки, сделать его ясным для всех участвующих в проекте людей.","Архитектура приложения — это способ организации приложения, его структура, набор модулей и связей между ними",1
"Архитектура программного приложения есть некоторая структура или же схема, которая описывает основные компоненты приложения и предусматривает их связь между собой. Различают много видов приложений, самыми известными из них являются монолитная и микросервисная архитектуры.","Архитектура приложения — это способ организации приложения, его структура, набор модулей и связей между ними",1
Архитектура программного приложения - совокупность принятых способов и принципов организации программного приложения.,"Архитектура приложения — это способ организации приложения, его структура, набор модулей и связей между ними",1
"Это внутреннее устройство программного приложения, где определяются различные взаимодействия между модулями","Архитектура приложения — это способ организации приложения, его структура, набор модулей и связей между ними",1
"Организация программной системы.
Включает в себя выбор структурных элементов интерфейса, внутренних моделей.","Архитектура приложения — это способ организации приложения, его структура, набор модулей и связей между ними",1
"Точного определения данного термина нет. Обычно в это вкладывают несколько условий: свойства, которые мы хотим заложить в наше приложение, шаблон, который будет использован для задания структуры приложения. Структурирование модулей.","Архитектура приложения — это способ организации приложения, его структура, набор модулей и связей между ними",1
"Архитектура программного приложения это способ построения этого приложения, его структура. Классы, данные, их связи. Архитектура важна для понимания процесса разработки приложения.","Архитектура приложения — это способ организации приложения, его структура, набор модулей и связей между ними",1
"Архитектура программного приложения это такой способ организации приложения, который описывает структуру приложения, организацию работы с данными и взаимодействие различных частей программы между собой","Архитектура приложения — это способ организации приложения, его структура, набор модулей и связей между ними",1
"Это структурное решение, которое определяет, как различные компоненты приложения будут взаимодействовать друг с другом. Она описывает высокоуровневую организацию системы, включая ее основные компоненты, их взаимосвязи и взаимодействия.","Архитектура приложения — это способ организации приложения, его структура, набор модулей и связей между ними",1
Способ построения всего приложения. Каким образом взаимодействуют между сбой части приложения.,"Архитектура приложения — это способ организации приложения, его структура, набор модулей и связей между ними",1
"Архитектура это основа, приложения. Она определяет, как будут функционировать компоненты приложения, и как они будут взаимодействовать друг с другом.","Архитектура приложения — это способ организации приложения, его структура, набор модулей и связей между ними",1
"Архитектура программного приложения - внутреннее устройство приложения, отношения между его частями","Архитектура приложения — это способ организации приложения, его структура, набор модулей и связей между ними",1
Это абстрактная логическая формальная концепция представления и организации работы с данными. Архитектура является начальным компонентом в проектировании программного приложения.,"Архитектура приложения — это способ организации приложения, его структура, набор модулей и связей между ними",1
"Архитектура программного обеспечения - способ ""дробления"" и взаимодействия ее компонентов между собой","Архитектура приложения — это способ организации приложения, его структура, набор модулей и связей между ними",1
"Архитектура программного приложения - структура программы, показывающая как должно работать приложение.","Архитектура приложения — это способ организации приложения, его структура, набор модулей и связей между ними",1
Архитектура приложения это совокупность каких либо решений для организации работы приложения,"Архитектура приложения — это способ организации приложения, его структура, набор модулей и связей между ними",1
"Это построение приложения по определенным инструкциями. Иными словами правила, по которым необходимо ""строить"" приложение","Архитектура приложения — это способ организации приложения, его структура, набор модулей и связей между ними",1
"Архитектура программного приложения — это структурное решение, описывающее, как различные компоненты приложения взаимодействуют друг с другом. Она определяет организацию кода, выбор технологий, паттерны проектирования и принципы, которые обеспечивают масштабируемость, производительность и поддерживаемость приложения. Архитектура помогает разработчикам понять, как строить и развивать приложение, а также облегчает его сопровождение и модификацию.","Архитектура приложения — это способ организации приложения, его структура, набор модулей и связей между ними",1
"Архитектура - это общий шаблон для организации всей программной системы, отталкиваясь от которой создается вся структура приложения.","Архитектура приложения — это способ организации приложения, его структура, набор модулей и связей между ними",1
"Архитектура это принципы построение логики какого-либо приложения. Архитектуру используют для упрощения написания логики, это очень удобно, когда в написании приложения используется группа людей.","Архитектура приложения — это способ организации приложения, его структура, набор модулей и связей между ними",1
"Структура системы, которая показывает ее части и как они между собой взаимодействуют","Архитектура приложения — это способ организации приложения, его структура, набор модулей и связей между ними",1
Способ организации устройства приложения.,"Архитектура приложения — это способ организации приложения, его структура, набор модулей и связей между ними",1
"Архитектура программного обеспечения - это набор решений, принятый разработчиком при создании программы.
Цели, задачи, структура программы, конечная реализация - всё это входит в архитектуру программного обеспечения.","Архитектура приложения — это способ организации приложения, его структура, набор модулей и связей между ними",1
Архитектура ПО - совокупность компонентов приложения и описаний их взаимодействия.,"Архитектура приложения — это способ организации приложения, его структура, набор модулей и связей между ними",1
"Архитектура программного приложения -- это система взаимоотношений между различными сущностями, которыми оперирует приложение","Архитектура приложения — это способ организации приложения, его структура, набор модулей и связей между ними",1
"Это описание программного продукта, которое показывает, ка различные компоненты приложения взаимодействуют друг с другом и образуют одно целое.","Архитектура приложения — это способ организации приложения, его структура, набор модулей и связей между ними",1
"архитектура приложения это совокупность программных модулей, сервисов, пакетов и настроек, которые, взаимодействуя с друг другом, образуют полную рабочую систему","Архитектура приложения — это способ организации приложения, его структура, набор модулей и связей между ними",1
"Свод правил и договорённостей, контролирующих работу и взаимодействие отдельных частей программного продукта","Архитектура приложения — это способ организации приложения, его структура, набор модулей и связей между ними",0
"Это структурный план, определяющий организацию и взаимодействие компонентов приложения. Она описывает, как различные части системы взаимодействуют друг с другом и какие технологии, паттерны и принципы будут использоваться при разработке.","Архитектура приложения — это способ организации приложения, его структура, набор модулей и связей между ними",1
"Архитектура программного приложения - метод внутренней организации приложения. Свод правил, следуя которым приложение реализуется.

Изученные ранее архитектуры:
MVC (модель-вид-контроллер)
MV (модель-вид)
MVD (модель-вид-делегат)","Архитектура приложения — это способ организации приложения, его структура, набор модулей и связей между ними",1
"Архитектура программного приложения - это бизнес модель, которая определяет логику и структуру приложения","Архитектура приложения — это способ организации приложения, его структура, набор модулей и связей между ними",1
"Архитектура ПО - это некоторые свойства, особенности приложения, общая концепция приложения. Архитектура бывает пристонская и гарвардская (фон-неймана), различные области памяти для инструкций использу","Архитектура приложения — это способ организации приложения, его структура, набор модулей и связей между ними",1
"Это вид организации системы в целом и взаимодействия между собой отдельных ее частей, а также задач для каждой ее части","Архитектура приложения — это способ организации приложения, его структура, набор модулей и связей между ними",1
"Это фундаментальная организация системы с её основными компанентами, их взаимодействием и принципами проектирования, определяющая структуры системы, способы их взаимодействия, принципы принятия решений","Архитектура приложения — это способ организации приложения, его структура, набор модулей и связей между ними",1
"это структура программного кода, которая определяет, как передаются компоненты, как данные передаются и обрабатываются, как разделяются функции между модулями. как пример: модель-вид-контроллер","Архитектура приложения — это способ организации приложения, его структура, набор модулей и связей между ними",1
"архитектура программного приложения - это план, по которому это приложение должно быть устроено. архитектура должна учитывать как взаимодействуют между собой элементы приложения и грамотно организовать это взаимодействие","Архитектура приложения — это способ организации приложения, его структура, набор модулей и связей между ними",1
"Архитектура программного приложения — максимально общие принципы и правила его работы, бизнес-логика.","Архитектура приложения — это способ организации приложения, его структура, набор модулей и связей между ними",1
"архитектура программного приложения это описание взаимодействия системы, ее компонентов, принципов и т.д (скелет программного приложения)","Архитектура приложения — это способ организации приложения, его структура, набор модулей и связей между ними",1
"Архитектура программного приложения - структура программы, включающая в себя классы, модули и т.п. Внутри архитектуры они взаимодействуют друг с другом, составляя программу","Архитектура приложения — это способ организации приложения, его структура, набор модулей и связей между ними",1
"Архитектура программного приложения - это его организация на идейном уровне, описание подхода к программированию. Она определяет, какие компоненты будут описываться в программе, как они будут взаимодействовать между собой, какому паттерну будут следовать программисты при разработке (к примеру, MVC или MVD) и т.п.","Архитектура приложения — это способ организации приложения, его структура, набор модулей и связей между ними",1
"Архитектура — это способ организации кода и данных, который определяет:
Из каких частей состоит программа
Как эти части взаимодействуют
Где и как хранятся данные и как они обрабатываются
Как программа развивается и масштрабируется","Архитектура приложения — это способ организации приложения, его структура, набор модулей и связей между ними",1
"В целом, это каркас приложения, который определяет из каких модулей состоит приложение, как элементы взаимосвязаны внутри, какие технологии и принципы применяются.","Архитектура приложения — это способ организации приложения, его структура, набор модулей и связей между ними",1
