answer,true_answer,mark
"Это способ организации кода, компонентов и их взаимодействия в приложениях","Архитектура приложения — это способ организации приложения, его структура, набор модулей и связей между ними",1
"Архитектура программного приложения - Это способ организации кода, компонентов и их взаимодействия в приложениях, то есть способ организации кода, модулей и зависимостей для создания масштабируемого, поддерживаемого и эффективного приложения.","Архитектура приложения — это способ организации приложения, его структура, набор модулей и связей между ними",1
"Архитектура программного приложения – это структура и организация компонентов программы, их взаимодействие друг с другом. Есть, например, архитектура модель-вид.","Архитектура приложения — это способ организации приложения, его структура, набор модулей и связей между ними",1
"Архитектура программного приложения - это способ организации кода, взаимодействия компонентов и управления данными","Архитектура приложения — это способ организации приложения, его структура, набор модулей и связей между ними",1
организация компонентов системы и их взаимодействия,"Архитектура приложения — это способ организации приложения, его структура, набор модулей и связей между ними",1
"Архитектура программного приложения - это высокоуровневый план, который определяет, как организованы компоненты приложения, как они взаимодействуют между собой и с внешними системами.","Архитектура приложения — это способ организации приложения, его структура, набор модулей и связей между ними",1
"Это структура системы, определяющая её элементы, их взаимодействие и способ разработки","Архитектура приложения — это способ организации приложения, его структура, набор модулей и связей между ними",1
"Это структура,которая определяет организацию и логику кода приложения(например,работа данных с видом(интерфейсом) приложения)","Архитектура приложения — это способ организации приложения, его структура, набор модулей и связей между ними",1
"это высокоуровневая структура программы, которая определяет, как компоненты приложения организованы, взаимодействуют и работают вместе для выполнения поставленных задач. Разделение программы на модули, способы взаимодействия между частями, принципы проектирования.","Архитектура приложения — это способ организации приложения, его структура, набор модулей и связей между ними",1
"это организация системы, включающая в себя организацию компонентов (отдельные классы в случае qt), взаимодействие компонентов (передача значений и тп), в целом структура приложения","Архитектура приложения — это способ организации приложения, его структура, набор модулей и связей между ними",1
"структура, которая описывает  компаненты (модули слои и тп) по, их взаимодействие между собой (события сооьщения и тп)
опред способ управ дааннными","Архитектура приложения — это способ организации приложения, его структура, набор модулей и связей между ними",1
"Это
Некий план, способ организовать код, который определяет как между собой будут взаимодействовать отдельные компоненты, как будут разделяться и управляться","Архитектура приложения — это способ организации приложения, его структура, набор модулей и связей между ними",1
"структура, определяющая организацию и взаимодействие компонентов приложения (например организация и взаимодействие данных и графического интерфейса)","Архитектура приложения — это способ организации приложения, его структура, набор модулей и связей между ними",1
"это способ организации кода приложения, позволяющий использовать некие принципы взаимодействия классов между собой, логику их работы.","Архитектура приложения — это способ организации приложения, его структура, набор модулей и связей между ними",1
"Это то, что определяет взаимодействия различных компонентов и модулей внутри приложения (для его работоспособности)
Включает:
Разбиение на компоненты и модули, определиение взаимодействий, выбор технологий и стандартов","Архитектура приложения — это способ организации приложения, его структура, набор модулей и связей между ними",1
"приложение строится на виджеты, окна, логика и их взаимодействии.
вот можно так сказать основная концепция:
1. Главное окно  – основа приложения (меню, панели, центральный виджет). 
2. Виджеты – элементы интерфейса. 
3. Сигналы и слоты – механизм реактивности (например, кнопка → действие). 
4. Модели – для работы с данными (например, `QTableView` + модель).
я думаю примерно так. так то ещё есть архитектурные подходы: MVC- подход","Архитектура приложения — это способ организации приложения, его структура, набор модулей и связей между ними",0
"Архитектура программного приложения - это структура организации кода, включающая графический интерфейс, логику обработки событий и управление данными, и обеспечивающие их взаимодействие. Основано на принципе Модель Вид Контроллер и сигналов слотов","Архитектура приложения — это способ организации приложения, его структура, набор модулей и связей между ними",1
"Архитектура программного приложения это общая структура и организация всех частей программы, создается для организации и эффективной работы программы","Архитектура приложения — это способ организации приложения, его структура, набор модулей и связей между ними",1
"Это структура, по которой организовано взаимодействие различных компонентов программы. Частый в pyqt это архитектура модель-вид-делегат часто используется при разработке пользовательских интерфейсов. Позволяет отображать одни и те же данные в нескольких разных представлениях и реализовывать новые типы представлений без изменения базовых структур данных","Архитектура приложения — это способ организации приложения, его структура, набор модулей и связей между ними",1
"это скелет системы, он определяет основные взаимодействия в приложении.
так же в нем содержатся основные методы для создания этого приложения","Архитектура приложения — это способ организации приложения, его структура, набор модулей и связей между ними",1
"Это структурное разделение системы на части, определение их взаимодействия и отношений между собой.Она описывает, как приложение будет работать и как его различные части будут взаимодействовать друг с другом.","Архитектура приложения — это способ организации приложения, его структура, набор модулей и связей между ними",1
"Архитектура программного приложения — это структурное описание системы, которое определяет, как различные компоненты приложения взаимодействуют друг с другом, как они организованы и какие технологии используются.
Архитектура помогает разработчикам понять, как приложение будет функционировать, и обеспечивает основу для его разработки, тестирования и поддержки","Архитектура приложения — это способ организации приложения, его структура, набор модулей и связей между ними",1
"Приложение состоит из главного окна, виджетов, сигналов и модели.","Архитектура приложения — это способ организации приложения, его структура, набор модулей и связей между ними",0
"Это структура ПО которая включает принципы работы, компоненты и способы взаимодействия","Архитектура приложения — это способ организации приложения, его структура, набор модулей и связей между ними",1
"это такая структура приложения, которая описывает организацию системы и взаимодействие еë компонентов","Архитектура приложения — это способ организации приложения, его структура, набор модулей и связей между ними",1
"Определённая структура или организация компонентов системы, их взаимосвязь и взаимодействие. Описывает как разные части приложения взаимодействуют друг с сдругом, какие подходы используются для решения задач.","Архитектура приложения — это способ организации приложения, его структура, набор модулей и связей между ними",1
"она сотстоит на принципах model/view. также используются модели, представители, сигналы и слоты. логика, ввод,","Архитектура приложения — это способ организации приложения, его структура, набор модулей и связей между ними",0
"это структура и организация компонентов программы, их взаимодействие и принципы работы","Архитектура приложения — это способ организации приложения, его структура, набор модулей и связей между ними",1
"Архитектура программного приложения - это способ построения программы, где есть интерфейс, логика работы и данные, а они взаимодействуют между собой через сигналы и слоты","Архитектура приложения — это способ организации приложения, его структура, набор модулей и связей между ними",1
"это план или структура, описывающая, как система организована, как разные ее части взаимодействуют между собой и с внешними системами.","Архитектура приложения — это способ организации приложения, его структура, набор модулей и связей между ними",1
"Архитектура приложения — это схема его основных частей (модулей) и то, как они связаны между собой.
Она показывает, где хранятся данные, как модули общаются и как приложение устроено внутри, чтобы его было проще поддерживать и развивать.
mvc
Например, архитектура MVC (Model-View-Controller):
- Model (Модель) — работает с данными и логикой.
- View (Представление) — показывает данные пользователю.
- Controller (Контроллер) — принимает действия пользователя и управляет моделью и","Архитектура приложения — это способ организации приложения, его структура, набор модулей и связей между ними",1
"Архитектура программного приложения — это организация системы, включающая её структурные элементы, их взаимодействие и принципы проектирования.","Архитектура приложения — это способ организации приложения, его структура, набор модулей и связей между ними",1
архитектура программного приложения включает в себя выбор элементов интерфейса приложения,"Архитектура приложения — это способ организации приложения, его структура, набор модулей и связей между ними",0
"это структурное описание системы, которое определяет, как компоненты приложения взаимодействуют друг с другом и как они организованы. помогает обеспечить масштабируемость, поддерживаемость и производительность приложения, а также упрощает процесс разработки и тестирования.","Архитектура приложения — это способ организации приложения, его структура, набор модулей и связей между ними",1
"Архитектура программного приложения — это структурный подход к проектированию и организации кода, который определяет, как различные компоненты приложения взаимодействуют друг с другом","Архитектура приложения — это способ организации приложения, его структура, набор модулей и связей между ними",1
"Это структурная организация кода, определяющая, как и где хранятся ресурсы, применяются стили, взаимодействуют компоненты.","Архитектура приложения — это способ организации приложения, его структура, набор модулей и связей между ними",1
"Это структура организации компонентов программного приложения, способы и механизмы их взаимодействия, например бывает монолитная архитектура, архитектура модель-вид-делегат, архитектура модель-вид-контроллер","Архитектура приложения — это способ организации приложения, его структура, набор модулей и связей между ними",1
"это структура классов и объектов приложения, их связей, обеспечивающих его функционирование","Архитектура приложения — это способ организации приложения, его структура, набор модулей и связей между ними",1
"это структурированный по определённым классам и интерфейсам каркас будущего приложения, где также присутствуют связи между элементами","Архитектура приложения — это способ организации приложения, его структура, набор модулей и связей между ними",1
"Архитектура программного приложения - это структура системы, которая определяет её компоненты, взаимодействие и организацию. Архитектура позволяет эффективно разрабатывать, поддерживать и масштабировать приложение.","Архитектура приложения — это способ организации приложения, его структура, набор модулей и связей между ними",1
"Архитектура программного приложения — это структура и организация его компонентов и то, как они взаимодействуют между собой.","Архитектура приложения — это способ организации приложения, его структура, набор модулей и связей между ними",1
"можно сказать это общий шаблон по которому построено приложение, а так же архитектура отвечает за связь компонентов между собой","Архитектура приложения — это способ организации приложения, его структура, набор модулей и связей между ними",1
"Архитектура программного приложения - это структура и организация его компонентов, определяющая, как они взаимодействуют между собой, чтобы выполнять задачи. Если говорить простыми словами, это ""скелет"" приложения, который задает, как оно работает и развивается.","Архитектура приложения — это способ организации приложения, его структура, набор модулей и связей между ними",1
"Архитектура программного приложения-структурная организация кода, которая определяет, где и как  взаимодействуют компоненты приложения, хранятся ресурсы и применяются стили.","Архитектура приложения — это способ организации приложения, его структура, набор модулей и связей между ними",1
"Архитектура приложения — это структура его компонентов и их взаимодействий.

Используется для:

Масштабируемости

Поддержки

Чёткой организации","Архитектура приложения — это способ организации приложения, его структура, набор модулей и связей между ними",1
"Архитектура программного приложения - это структура и организация всех его компонентов, которые определяют, как оно будет разрабатываться, поддерживаться и развиваться.","Архитектура приложения — это способ организации приложения, его структура, набор модулей и связей между ними",1
"структура в которой собраны все компоненты приложения, их описание, взаимодействие между друг другом","Архитектура приложения — это способ организации приложения, его структура, набор модулей и связей между ними",1
"Структура программного приложения это организация системы, всех ее компонентов, взаимосвязей между ними и принципов их взаимодействия. Она определяет как приложение будет разрабатываться, тестироваться и поддерживаться","Архитектура приложения — это способ организации приложения, его структура, набор модулей и связей между ними",1
